score,creationTime,content
5,2018-05-09 19:27:22,非常好的商品，完美的购物体验，下次还来京东商城网购
5,2018-05-02 15:13:16,不错，为阮大神而买，讲解很透彻，值得一看
0,2018-05-04 14:55:47,非常值得
5,2018-03-22 12:03:18,好用，真的好用，推荐大家购买
5,2018-05-01 21:16:13,内容很详实，还可以。
5,2018-03-12 02:39:07,帮公司买的，用得很好，送货速度也很快
5,2018-04-28 20:48:36,很好的商品，其实大神提供的电子版的早都看过了，真的很好，所以要买一本支持一下
5,2018-03-02 22:12:49,很好，很不错\n值得买
5,2018-04-28 19:53:45,东西很好，非常好，以后还会经常来买，推荐你们也来买
5,2018-03-28 23:16:26,书很好，特别喜欢，还是纸质的书更好一些，支持正版
5,2018-04-28 09:47:41,京东商城给予的优质的服务，从仓储管理、物流配送等各方面都是做的非常好的。送货及时，配送员也非常的热情，有时候不方便收件的时候，也安排时间另行配送。同时京东商城在售后管理上也非常好的，以解客户忧患，排除万难
5,2018-04-11 20:35:00,京东商城给予的优质的服务，从仓储管理、物流配送等各方面都是做的非常好的。送货及时，配送员也非常的热情，有时候不方便收件的时候，也安排时间另行配送。同时京东商城在售后管理上也非常好的，以解客户忧患，排除万难
0,2018-04-21 16:07:33,很有名的书
5,2018-03-18 09:50:07,这本书很好，可以购买。
5,2018-04-20 10:46:33,送货很快，质量也很好，总之很满意。
5,2018-04-17 10:13:29,物流超快的，包装很精美，先好评
5,2018-04-19 14:50:37,很适合入门，值得购买
5,2018-04-18 14:23:35,纸张很不错，内容还没有看！
5,2018-04-18 19:11:06,正版工具书，内容很详尽，是学习前端的必备神器
5,2018-04-15 20:10:01,这本书还是很值得看的，讲的很多章节都会对比es5，涉及一些基本原理，同时也不啰嗦，每个部分都会有对应的代码最佳实践，值得通读两遍的函数。
5,2018-04-17 08:54:06,这本书用来学习es6语法很好，很佩服阮老师
0,2018-04-10 17:05:44,书很好，学到很多知识，要好好看看！
5,2018-03-03 00:59:22,可以可以，很满意
5,2018-04-10 08:54:05,输很不错，超级棒
5,2018-03-26 13:37:44,经典，内容通俗易懂，讲的也很仔细，个人感觉比阮大神的更好入门，能更好的去深入了解
5,2018-04-07 17:56:58,好书，一直很羡慕阮一峰，前端大牛
5,2018-04-07 00:28:50,包装好，物流很快，不错
5,2018-04-06 21:52:32,上午下单下午发到，京东自营杠杠的
5,2018-04-04 11:05:57,已看完，书很不错讲的很细。
5,2018-04-04 18:30:56,这本书举例详细，内容丰富，很好
0,2018-03-24 10:22:11,书看着还可以，很适合入门，加油，自己！
5,2018-02-04 13:49:51,讷讷，不错哦。感觉。感觉不错，价格也很公道，值的购买！
5,2018-03-19 19:49:57,书很不错，内容丰富，知识点比较全面，希望看完这本书能够让自己的技能有所提升，发货速度也比较快，物超所值。
5,2018-03-19 19:52:18,不错，很完美，没有破损等质量问题，阮一峰的书，支持一波，毕竟看了好久的博客。
5,2018-03-19 19:52:18,挺好的五星
5,2018-03-06 10:11:55,非常好的书，我看这个受益匪浅。学习了
5,2018-03-18 13:36:07,书收到了，送货速度超级快，下午定第二天一早就到了。翻了几页看了下是正版图书。
5,2018-03-08 21:56:39,非常好的一本书，值得一读！！！！
5,2018-03-16 23:33:56,帮公司买的书，质量很好，都是正品，下次买书还会选择京东
5,2018-02-03 14:06:42,很好的东西，下次还会选择购买。
0,2018-03-04 19:19:46,宝贝收到，物超所值，物流速度快老板态度好，下次有需还来哦
5,2018-02-27 18:47:50,这个可以，很早就关注了，书很行，内容都在电子版读过了，为了使用的时候能随手翻翻，买了实体书！
5,2018-02-27 18:30:58,东西不错，很有用，值得推荐购买
5,2018-01-29 20:57:40,书很好，全新的，还没看，会再买
5,2018-02-16 11:30:28,不错看着很有用在学习中
5,2018-01-03 12:38:55,卖给别人的，质量很好，希望提升技术的赶紧买呀
5,2018-02-13 17:03:06,不错，特别好，质量不错。
5,2018-02-12 00:07:04,非常好的书，随便翻几页都感觉能学到东西
5,2018-02-12 11:01:33,方便，快捷，整齐，认真，非常满意！
5,2017-12-23 21:09:01,书很新，是正版，质量很好，一直在京东买书，送货快。。。。。。
0,2018-02-03 20:49:47,宝贝很是不错，物有所值。物流也很快。
5,2017-12-20 22:58:28,很好，非常好！
5,2018-01-29 22:40:29,第一次在京东购买图书，很给力。。
5,2018-01-24 15:35:45,很喜欢，很全很好的一本书，京东自营给力啊
5,2018-01-29 13:45:34,非常好，又多了一片知识的海洋！
5,2018-01-24 01:13:13,看了两天来评价，书很厚，知识点比较全面，简单易懂！
5,2018-01-29 11:14:54,很不错，值了
5,2018-01-16 10:23:25,书很好，很是发人深省，通俗易懂，让人顿悟，值得购买
5,2018-01-26 12:27:34,很好，提升水平
0,2018-01-19 13:05:14,物流很快，继续学习知识
5,2018-01-17 18:26:40,必须支持，非常赞
5,2018-01-19 08:55:43,简直不要太棒，太好了
5,2017-11-21 21:00:23,很好的书，快递也挺快的，好评。
5,2018-01-17 19:58:19,东西不错，还没用，看着就很好。
5,2018-01-02 19:34:57,书籍很好，包装也很好，非常满意
5,2018-01-15 18:58:00,不错，这本书不错，质量很好，然后包装也很好，物流也很快。
5,2017-11-21 17:19:04,大神的书写的真心不错。。。。。。
5,2018-01-11 17:18:51,物美价廉，物有所值，值得购买！
0,2018-01-01 08:13:11,超级超级大爱，总是看屏幕，眼睛都不舒服了，有了这本书，放松了眼睛，躺在床上都没问题
5,2017-12-09 14:38:17,书很不错，看了3章\n有部分勘误，挺失望的
5,2017-12-27 14:42:42,非常的nice
5,2017-12-17 17:29:38,可以，质量很好
5,2017-12-26 21:17:17,就很好~~~都很喜欢！！！！学到了很多
5,2017-12-20 16:25:19,太好了，很适合
5,2017-12-24 22:03:32,很厚的一本书，包装很精美，京东很方便
5,2017-12-20 20:32:24,很经典的一本书，买了最新版的，巩固一下es6基础
5,2017-12-23 09:42:56,凑满十个字的绝对好评
5,2017-10-27 10:42:55,书很好！已经看完一遍~
0,2017-12-17 16:49:39,很好的一本书，准备学习了
5,2017-12-12 22:58:30,书很好，很棒的一本书
5,2017-12-17 16:49:17,好得很
5,2017-12-12 22:58:30,书的包装很好，纸张质量还可以，值得够买
5,2017-12-15 10:32:20,很好的工具书，平时上班可以查。
5,2017-12-12 21:00:11,5个小时送到，非常给力。看了一下印刷质量很好，作者也是老熟人了，讲的确实好。
5,2017-12-15 10:17:34,商品不错很信赖京东继续加油优惠活动多做点
5,2017-12-10 01:02:50,质量很不错?
5,2017-12-14 14:54:13,好评，快递很快，经常看阮的博客。
5,2017-12-13 09:26:09,非常好的一本书，值得学习
0,2017-12-06 21:19:07,质量不错，内容还没看，据说很好?
5,2017-12-05 22:14:36,京东太快了，晚上下单，第二天就从千里之外送过来了，就服你
5,2017-12-05 17:43:16,阮一峰的书，一如既往的好，讲解毒很清楚，难能可贵的是里面有很多具体的应用实例
5,2017-12-04 17:48:20,很好，适合我
5,2017-12-03 15:08:11,好好好好，经典，经典，京东速度也是杠杠滴
5,2017-10-24 23:22:52,京东的东西都很好，售后满意呀
5,2017-12-02 20:19:01,很全面，最新的规范。好书
5,2017-11-22 00:28:25,很好，物流很快，还没开始看，不知道书怎么样，等有时间再看！！！！
5,2017-12-02 10:48:05,在看，不错很给力
0,2017-11-15 15:36:25,很好的一本书，与另一本一起买的
5,2017-09-07 19:22:08,很好正版不错不错不错不错
5,2017-11-15 12:46:00,书非常好，包装不，错，好好看书。。。，。，。
5,2017-11-03 19:29:17,能按时到，非常满意。物品也不错。推荐大家选购，下次再来。点赞啦。
5,2017-11-13 09:04:55,阮大神的书还是很厉害的
5,2017-10-11 16:09:46,理论很强
5,2017-11-12 19:19:09,挺好的，排版很宽松，看起来不费力
5,2017-09-05 10:44:39,真的很好，很实惠，非常喜欢，下次还会光顾！
5,2017-11-12 11:52:27,电子版看着不爽。很不错的书，努力学习
5,2017-11-11 12:00:22,为支持网上免费开源买的一本书，活动力度大，非常不错
0,2017-11-08 12:21:36,书籍是人类进步的阶梯，多读书才能有所得，书的质量也很关键，好的质量使人身心愉悦。
5,2017-10-17 10:51:25,质量很好，，学习了很多新知识
5,2017-11-08 11:14:32,物流包装很严实，书印刷的也很好
5,2017-10-06 10:54:54,非常不错的一本书。知识点讲的非常透彻。
5,2017-11-07 19:41:14,速度很快，包装很好的，可以的。价格还是比较合理！
5,2017-11-04 23:01:27,可以，很不错可以，很不错
5,2017-11-07 12:26:01,很好很强大很好很强大，商品非常完美，绝对超赞
5,2017-08-16 19:01:15,是正品，家人很满意的哦
5,2017-11-07 10:33:00,书很好，送货及时。每个月都在京东买书。
5,2017-10-19 17:07:13,支持下阮一峰老师，毕竟从他的博客上学到了很多知识
0,2017-11-05 15:49:04,双11活动购买，单位集体采购，很不错活动，极大满足了需求！好评！
5,2017-10-30 13:38:52,本书网上有网页版，内容很好，为了感谢作者又买了书
5,2017-11-05 03:29:49,很好，透彻，通俗易懂
5,2017-08-17 10:20:32,书纸质可以，是正版书。活动价很便宜。
5,2017-11-04 17:45:04,很好的书，纸质也完全ok，赞一个
5,2017-11-01 17:21:19,书很厚实的，github上九千五星的内容自然不必说。
5,2017-11-03 13:45:07,很专业，。没事的时候看看不错
